{
  "schema_version": "uisemtest-recording-workflow-result-v1",
  "status": "completed",
  "workflow_id": "rwa-modular-l1-bank-01",
  "workflow_ref": "<ARTIFACT_ROOT>/fixtures/recording_workflows/rwa_modular/l1-bank-01.json",
  "profile_ref": "<ARTIFACT_ROOT>/fixtures/profiles/rwa_modular_local.json",
  "reset_epoch": {
    "status": "completed",
    "record_id": "rwa:565339bc4d33d728:2026-09-02T02:14:42.251909Z",
    "artifact_ref": "reset/reset.json"
  },
  "actor_bundles": [
    {
      "actor_id": "actor_a",
      "manifest_ref": "actors/actor_a/r20260902-021525-3189/session_bundle/manifest.json",
      "run_id": "r20260902-021525-3189"
    }
  ],
  "step_correspondence": [
    {
      "status": "step_completed",
      "scenario_step_id": "story.s000",
      "workflow_step_id": "story.s000.open-bank-accounts",
      "global_step_index": 0,
      "actor_id": "actor_a",
      "action_id": "workflow-action-0000",
      "started_at": "2026-09-02T02:15:35.925+00:00",
      "ended_at": "2026-09-02T02:15:37.783+00:00",
      "binding_material_source_step_ids": []
    },
    {
      "status": "step_completed",
      "scenario_step_id": "story.s001",
      "workflow_step_id": "story.s001.create-bank-account",
      "global_step_index": 1,
      "actor_id": "actor_a",
      "action_id": "workflow-action-0001",
      "started_at": "2026-09-02T02:15:37.794+00:00",
      "ended_at": "2026-09-02T02:15:38.780+00:00",
      "binding_material_source_step_ids": []
    },
    {
      "status": "step_completed",
      "scenario_step_id": "story.s002",
      "workflow_step_id": "story.s002.fill-bank-name",
      "global_step_index": 2,
      "actor_id": "actor_a",
      "action_id": "workflow-action-0002",
      "started_at": "2026-09-02T02:15:38.820+00:00",
      "ended_at": "2026-09-02T02:15:39.079+00:00",
      "binding_material_source_step_ids": []
    },
    {
      "status": "step_completed",
      "scenario_step_id": "story.s003",
      "workflow_step_id": "story.s003.fill-routing-number",
      "global_step_index": 3,
      "actor_id": "actor_a",
      "action_id": "workflow-action-0003",
      "started_at": "2026-09-02T02:15:39.229+00:00",
      "ended_at": "2026-09-02T02:15:39.510+00:00",
      "binding_material_source_step_ids": []
    },
    {
      "status": "step_completed",
      "scenario_step_id": "story.s004",
      "workflow_step_id": "story.s004.fill-account-number",
      "global_step_index": 4,
      "actor_id": "actor_a",
      "action_id": "workflow-action-0004",
      "started_at": "2026-09-02T02:15:39.639+00:00",
      "ended_at": "2026-09-02T02:15:39.935+00:00",
      "binding_material_source_step_ids": []
    },
    {
      "status": "step_completed",
      "scenario_step_id": "story.s005",
      "workflow_step_id": "story.s005.save-bank-account",
      "global_step_index": 5,
      "actor_id": "actor_a",
      "action_id": "workflow-action-0005",
      "started_at": "2026-09-02T02:15:40.097+00:00",
      "ended_at": "2026-09-02T02:15:42.657+00:00",
      "binding_material_source_step_ids": [
        "story.s002.fill-bank-name",
        "story.s003.fill-routing-number",
        "story.s004.fill-account-number"
      ]
    }
  ],
  "failure": null
}
