{
  "schema_version": "uisemtest-recording-workflow-result-v1",
  "status": "completed",
  "workflow_id": "ghost-modular-l2-member-03",
  "workflow_ref": "<ARTIFACT_ROOT>/fixtures/recording_workflows/ghost_modular/l2-member-03.json",
  "profile_ref": "<ARTIFACT_ROOT>/fixtures/profiles/ghost_modular_local.json",
  "reset_epoch": {
    "status": "completed",
    "record_id": "ghost-docker-single:2d6995837127d4e6c77bc0c2",
    "artifact_ref": "reset/reset.json"
  },
  "actor_bundles": [
    {
      "actor_id": "actor_a",
      "manifest_ref": "actors/actor_a/r20260920-170620-c734/session_bundle/manifest.json",
      "run_id": "r20260920-170620-c734"
    }
  ],
  "step_correspondence": [
    {
      "status": "step_completed",
      "scenario_step_id": "story.s000",
      "workflow_step_id": "story.s000.click-a-new-member",
      "global_step_index": 0,
      "actor_id": "actor_a",
      "action_id": "workflow-action-0000",
      "started_at": "2026-09-20T17:06:23.251+00:00",
      "ended_at": "2026-09-20T17:06:23.830+00:00",
      "binding_material_source_step_ids": []
    },
    {
      "status": "step_completed",
      "scenario_step_id": "story.s001",
      "workflow_step_id": "story.s001.fill-member-name",
      "global_step_index": 1,
      "actor_id": "actor_a",
      "action_id": "workflow-action-0001",
      "started_at": "2026-09-20T17:06:25.399+00:00",
      "ended_at": "2026-09-20T17:06:26.172+00:00",
      "binding_material_source_step_ids": []
    },
    {
      "status": "step_completed",
      "scenario_step_id": "story.s002",
      "workflow_step_id": "story.s002.fill-member-email",
      "global_step_index": 2,
      "actor_id": "actor_a",
      "action_id": "workflow-action-0002",
      "started_at": "2026-09-20T17:06:27.738+00:00",
      "ended_at": "2026-09-20T17:06:28.514+00:00",
      "binding_material_source_step_ids": []
    },
    {
      "status": "step_completed",
      "scenario_step_id": "story.s003",
      "workflow_step_id": "story.s003.click-save",
      "global_step_index": 3,
      "actor_id": "actor_a",
      "action_id": "workflow-action-0003",
      "started_at": "2026-09-20T17:06:30.080+00:00",
      "ended_at": "2026-09-20T17:06:31.108+00:00",
      "binding_material_source_step_ids": []
    },
    {
      "status": "step_completed",
      "scenario_step_id": "story.s004",
      "workflow_step_id": "story.s004.click-member-actions",
      "global_step_index": 4,
      "actor_id": "actor_a",
      "action_id": "workflow-action-0004",
      "started_at": "2026-09-20T17:06:32.676+00:00",
      "ended_at": "2026-09-20T17:06:33.216+00:00",
      "binding_material_source_step_ids": []
    },
    {
      "status": "step_completed",
      "scenario_step_id": "story.s005",
      "workflow_step_id": "story.s005.click-delete-member",
      "global_step_index": 5,
      "actor_id": "actor_a",
      "action_id": "workflow-action-0005",
      "started_at": "2026-09-20T17:06:34.789+00:00",
      "ended_at": "2026-09-20T17:06:35.332+00:00",
      "binding_material_source_step_ids": []
    },
    {
      "status": "step_completed",
      "scenario_step_id": "story.s006",
      "workflow_step_id": "story.s006.click-confirm",
      "global_step_index": 6,
      "actor_id": "actor_a",
      "action_id": "workflow-action-0006",
      "started_at": "2026-09-20T17:06:36.902+00:00",
      "ended_at": "2026-09-20T17:06:37.839+00:00",
      "binding_material_source_step_ids": []
    }
  ],
  "failure": null
}
