{
  "schema_version": "uisemtest-recording-workflow-result-v1",
  "status": "completed",
  "workflow_id": "umami-l1-session-03",
  "workflow_ref": "<ARTIFACT_ROOT>/fixtures/recording_workflows/umami_modular/l1-session-03.json",
  "profile_ref": "<ARTIFACT_ROOT>/fixtures/profiles/umami_modular_local.json",
  "reset_epoch": {
    "status": "completed",
    "record_id": "umami-docker-single:cc28d4070a8b69ac25906207",
    "artifact_ref": "reset/reset.json"
  },
  "actor_bundles": [
    {
      "actor_id": "actor_a",
      "manifest_ref": "actors/actor_a/r20260920-082729-c037/session_bundle/manifest.json",
      "run_id": "r20260920-082729-c037"
    }
  ],
  "step_correspondence": [
    {
      "status": "step_completed",
      "scenario_step_id": "story.s000",
      "workflow_step_id": "story.s000.navigate",
      "global_step_index": 0,
      "actor_id": "actor_a",
      "action_id": "workflow-action-0000",
      "started_at": "2026-09-20T08:27:30.373+00:00",
      "ended_at": "2026-09-20T08:27:30.767+00:00",
      "binding_material_source_step_ids": []
    }
  ],
  "failure": null
}
