{
  "schema_version": "uisemtest-recording-workflow-result-v1",
  "status": "completed",
  "workflow_id": "ghost-modular-l1-post-08",
  "workflow_ref": "<ARTIFACT_ROOT>/fixtures/recording_workflows/ghost_modular/l1-post-08.json",
  "profile_ref": "<ARTIFACT_ROOT>/fixtures/profiles/ghost_modular_local.json",
  "reset_epoch": {
    "status": "completed",
    "record_id": "ghost-docker-single:cc7c9916932f3f517809817b",
    "artifact_ref": "reset/reset.json"
  },
  "actor_bundles": [
    {
      "actor_id": "actor_a",
      "manifest_ref": "actors/actor_a/r20260920-170122-f8c6/session_bundle/manifest.json",
      "run_id": "r20260920-170122-f8c6"
    }
  ],
  "step_correspondence": [
    {
      "status": "step_completed",
      "scenario_step_id": "story.s000",
      "workflow_step_id": "story.s000.click-new-post",
      "global_step_index": 0,
      "actor_id": "actor_a",
      "action_id": "workflow-action-0000",
      "started_at": "2026-09-20T17:01:24.454+00:00",
      "ended_at": "2026-09-20T17:01:25.048+00:00",
      "binding_material_source_step_ids": []
    },
    {
      "status": "step_completed",
      "scenario_step_id": "story.s001",
      "workflow_step_id": "story.s001.fill-editor-title",
      "global_step_index": 1,
      "actor_id": "actor_a",
      "action_id": "workflow-action-0001",
      "started_at": "2026-09-20T17:01:26.615+00:00",
      "ended_at": "2026-09-20T17:01:27.385+00:00",
      "binding_material_source_step_ids": []
    },
    {
      "status": "step_completed",
      "scenario_step_id": "story.s002",
      "workflow_step_id": "story.s002.press-enter",
      "global_step_index": 2,
      "actor_id": "actor_a",
      "action_id": "workflow-action-0002",
      "started_at": "2026-09-20T17:01:28.950+00:00",
      "ended_at": "2026-09-20T17:01:33.185+00:00",
      "binding_material_source_step_ids": []
    },
    {
      "status": "step_completed",
      "scenario_step_id": "story.s003",
      "workflow_step_id": "story.s003.click-psm-trigger",
      "global_step_index": 3,
      "actor_id": "actor_a",
      "action_id": "workflow-action-0003",
      "started_at": "2026-09-20T17:01:34.751+00:00",
      "ended_at": "2026-09-20T17:01:35.557+00:00",
      "binding_material_source_step_ids": []
    },
    {
      "status": "step_completed",
      "scenario_step_id": "story.s004",
      "workflow_step_id": "story.s004.fill-name-post-setting",
      "global_step_index": 4,
      "actor_id": "actor_a",
      "action_id": "workflow-action-0004",
      "started_at": "2026-09-20T17:01:37.126+00:00",
      "ended_at": "2026-09-20T17:01:37.899+00:00",
      "binding_material_source_step_ids": []
    },
    {
      "status": "step_completed",
      "scenario_step_id": "story.s005",
      "workflow_step_id": "story.s005.press-enter",
      "global_step_index": 5,
      "actor_id": "actor_a",
      "action_id": "workflow-action-0005",
      "started_at": "2026-09-20T17:01:39.468+00:00",
      "ended_at": "2026-09-20T17:01:40.386+00:00",
      "binding_material_source_step_ids": []
    }
  ],
  "failure": null
}
