{
  "schema_version": "uisemtest-recording-workflow-result-v1",
  "status": "completed",
  "workflow_id": "l1-dashboard-04",
  "workflow_ref": "<ARTIFACT_ROOT>/fixtures/recording_workflows/paperless_modular/l1-dashboard-04.json",
  "profile_ref": "<ARTIFACT_ROOT>/fixtures/profiles/paperless_modular_local.json",
  "reset_epoch": {
    "status": "completed",
    "record_id": "paperless-docker-single:895996f92c5e24b898639e4b",
    "artifact_ref": "reset/reset.json"
  },
  "actor_bundles": [
    {
      "actor_id": "actor_a",
      "manifest_ref": "actors/actor_a/r20260920-085303-84e4/session_bundle/manifest.json",
      "run_id": "r20260920-085303-84e4"
    }
  ],
  "step_correspondence": [
    {
      "status": "step_completed",
      "scenario_step_id": "story.s000",
      "workflow_step_id": "story.s000.navigate",
      "global_step_index": 0,
      "actor_id": "actor_a",
      "action_id": "workflow-action-0000",
      "started_at": "2026-09-20T08:53:05.605+00:00",
      "ended_at": "2026-09-20T08:53:06.685+00:00",
      "binding_material_source_step_ids": []
    },
    {
      "status": "step_completed",
      "scenario_step_id": "story.s001",
      "workflow_step_id": "story.s001.click",
      "global_step_index": 1,
      "actor_id": "actor_a",
      "action_id": "workflow-action-0001",
      "started_at": "2026-09-20T08:53:08.245+00:00",
      "ended_at": "2026-09-20T08:53:09.656+00:00",
      "binding_material_source_step_ids": []
    }
  ],
  "failure": null
}
