{
  "schema_version": "uisemtest-recording-workflow-result-v1",
  "status": "completed",
  "workflow_id": "ghost-modular-l1-tag-04",
  "workflow_ref": "<ARTIFACT_ROOT>/fixtures/recording_workflows/ghost_modular/l1-tag-04.json",
  "profile_ref": "<ARTIFACT_ROOT>/fixtures/profiles/ghost_modular_local.json",
  "reset_epoch": {
    "status": "completed",
    "record_id": "ghost-docker-single:0e073cc5e95c0f1c6b2a9dff",
    "artifact_ref": "reset/reset.json"
  },
  "actor_bundles": [
    {
      "actor_id": "actor_a",
      "manifest_ref": "actors/actor_a/r20260920-170457-18f9/session_bundle/manifest.json",
      "run_id": "r20260920-170457-18f9"
    }
  ],
  "step_correspondence": [
    {
      "status": "step_completed",
      "scenario_step_id": "story.s000",
      "workflow_step_id": "story.s000.click-a-href-tags",
      "global_step_index": 0,
      "actor_id": "actor_a",
      "action_id": "workflow-action-0000",
      "started_at": "2026-09-20T17:05:00.211+00:00",
      "ended_at": "2026-09-20T17:05:00.780+00:00",
      "binding_material_source_step_ids": []
    },
    {
      "status": "step_completed",
      "scenario_step_id": "story.s001",
      "workflow_step_id": "story.s001.fill-tag-name",
      "global_step_index": 1,
      "actor_id": "actor_a",
      "action_id": "workflow-action-0001",
      "started_at": "2026-09-20T17:05:02.346+00:00",
      "ended_at": "2026-09-20T17:05:03.116+00:00",
      "binding_material_source_step_ids": []
    },
    {
      "status": "step_completed",
      "scenario_step_id": "story.s002",
      "workflow_step_id": "story.s002.fill-tag-description",
      "global_step_index": 2,
      "actor_id": "actor_a",
      "action_id": "workflow-action-0002",
      "started_at": "2026-09-20T17:05:04.687+00:00",
      "ended_at": "2026-09-20T17:05:05.459+00:00",
      "binding_material_source_step_ids": []
    },
    {
      "status": "step_completed",
      "scenario_step_id": "story.s003",
      "workflow_step_id": "story.s003.click-primary-save",
      "global_step_index": 3,
      "actor_id": "actor_a",
      "action_id": "workflow-action-0003",
      "started_at": "2026-09-20T17:05:07.026+00:00",
      "ended_at": "2026-09-20T17:05:07.970+00:00",
      "binding_material_source_step_ids": []
    }
  ],
  "failure": null
}
