{
  "schema_version": "uisemtest-recording-workflow-result-v1",
  "status": "completed",
  "workflow_id": "conduit-modular-l1-auth-02",
  "workflow_ref": "<ARTIFACT_ROOT>/fixtures/recording_workflows/conduit_modular/l1-auth-02.json",
  "profile_ref": "<ARTIFACT_ROOT>/fixtures/profiles/conduit_guest_current_local.json",
  "reset_epoch": {
    "status": "completed",
    "record_id": "conduit-current:270348fc93ca25190440d0bc",
    "artifact_ref": "reset/reset.json"
  },
  "actor_bundles": [
    {
      "actor_id": "guest",
      "manifest_ref": "actors/guest/r20260906-141913-f2c7/session_bundle/manifest.json",
      "run_id": "r20260906-141913-f2c7"
    }
  ],
  "step_correspondence": [
    {
      "status": "step_completed",
      "scenario_step_id": "story.s000",
      "workflow_step_id": "story.s000.open-register",
      "global_step_index": 0,
      "actor_id": "guest",
      "action_id": "workflow-action-0000",
      "started_at": "2026-09-06T14:19:14.173+00:00",
      "ended_at": "2026-09-06T14:19:14.887+00:00",
      "binding_material_source_step_ids": []
    },
    {
      "status": "step_completed",
      "scenario_step_id": "story.s001",
      "workflow_step_id": "story.s001.fill-username",
      "global_step_index": 1,
      "actor_id": "guest",
      "action_id": "workflow-action-0001",
      "started_at": "2026-09-06T14:19:14.892+00:00",
      "ended_at": "2026-09-06T14:19:14.899+00:00",
      "binding_material_source_step_ids": []
    },
    {
      "status": "step_completed",
      "scenario_step_id": "story.s002",
      "workflow_step_id": "story.s002.fill-email",
      "global_step_index": 2,
      "actor_id": "guest",
      "action_id": "workflow-action-0002",
      "started_at": "2026-09-06T14:19:14.903+00:00",
      "ended_at": "2026-09-06T14:19:14.911+00:00",
      "binding_material_source_step_ids": []
    },
    {
      "status": "step_completed",
      "scenario_step_id": "story.s003",
      "workflow_step_id": "story.s003.fill-password",
      "global_step_index": 3,
      "actor_id": "guest",
      "action_id": "workflow-action-0003",
      "started_at": "2026-09-06T14:19:14.915+00:00",
      "ended_at": "2026-09-06T14:19:14.920+00:00",
      "binding_material_source_step_ids": []
    },
    {
      "status": "step_completed",
      "scenario_step_id": "story.s004",
      "workflow_step_id": "story.s004.submit-register",
      "global_step_index": 4,
      "actor_id": "guest",
      "action_id": "workflow-action-0004",
      "started_at": "2026-09-06T14:19:14.924+00:00",
      "ended_at": "2026-09-06T14:19:15.052+00:00",
      "binding_material_source_step_ids": []
    },
    {
      "status": "step_completed",
      "scenario_step_id": "story.s005",
      "workflow_step_id": "story.s005.open-user-menu",
      "global_step_index": 5,
      "actor_id": "guest",
      "action_id": "workflow-action-0005",
      "started_at": "2026-09-06T14:19:15.056+00:00",
      "ended_at": "2026-09-06T14:19:15.085+00:00",
      "binding_material_source_step_ids": []
    },
    {
      "status": "step_completed",
      "scenario_step_id": "story.s006",
      "workflow_step_id": "story.s006.logout",
      "global_step_index": 6,
      "actor_id": "guest",
      "action_id": "workflow-action-0006",
      "started_at": "2026-09-06T14:19:15.089+00:00",
      "ended_at": "2026-09-06T14:19:15.115+00:00",
      "binding_material_source_step_ids": []
    },
    {
      "status": "step_completed",
      "scenario_step_id": "story.s007",
      "workflow_step_id": "story.s007.observe-original-profile-before",
      "global_step_index": 7,
      "actor_id": "guest",
      "action_id": "workflow-action-0007",
      "started_at": "2026-09-06T14:19:15.121+00:00",
      "ended_at": "2026-09-06T14:19:15.130+00:00",
      "binding_material_source_step_ids": []
    },
    {
      "status": "step_completed",
      "scenario_step_id": "story.s008",
      "workflow_step_id": "story.s008.open-register",
      "global_step_index": 8,
      "actor_id": "guest",
      "action_id": "workflow-action-0008",
      "started_at": "2026-09-06T14:19:15.136+00:00",
      "ended_at": "2026-09-06T14:19:15.181+00:00",
      "binding_material_source_step_ids": []
    },
    {
      "status": "step_completed",
      "scenario_step_id": "story.s009",
      "workflow_step_id": "story.s009.fill-other-username",
      "global_step_index": 9,
      "actor_id": "guest",
      "action_id": "workflow-action-0009",
      "started_at": "2026-09-06T14:19:15.186+00:00",
      "ended_at": "2026-09-06T14:19:15.189+00:00",
      "binding_material_source_step_ids": []
    },
    {
      "status": "step_completed",
      "scenario_step_id": "story.s010",
      "workflow_step_id": "story.s010.fill-duplicate-email",
      "global_step_index": 10,
      "actor_id": "guest",
      "action_id": "workflow-action-0010",
      "started_at": "2026-09-06T14:19:15.193+00:00",
      "ended_at": "2026-09-06T14:19:15.197+00:00",
      "binding_material_source_step_ids": []
    },
    {
      "status": "step_completed",
      "scenario_step_id": "story.s011",
      "workflow_step_id": "story.s011.fill-password-again",
      "global_step_index": 11,
      "actor_id": "guest",
      "action_id": "workflow-action-0011",
      "started_at": "2026-09-06T14:19:15.200+00:00",
      "ended_at": "2026-09-06T14:19:15.205+00:00",
      "binding_material_source_step_ids": []
    },
    {
      "status": "step_completed",
      "scenario_step_id": "story.s012",
      "workflow_step_id": "story.s012.submit-duplicate-register",
      "global_step_index": 12,
      "actor_id": "guest",
      "action_id": "workflow-action-0012",
      "started_at": "2026-09-06T14:19:15.209+00:00",
      "ended_at": "2026-09-06T14:19:15.243+00:00",
      "binding_material_source_step_ids": []
    },
    {
      "status": "step_completed",
      "scenario_step_id": "story.s013",
      "workflow_step_id": "story.s013.observe-original-profile-after",
      "global_step_index": 13,
      "actor_id": "guest",
      "action_id": "workflow-action-0013",
      "started_at": "2026-09-06T14:19:15.246+00:00",
      "ended_at": "2026-09-06T14:19:15.260+00:00",
      "binding_material_source_step_ids": []
    }
  ],
  "failure": null
}
