{
  "schema_version": "uisemtest-recording-workflow-result-v1",
  "status": "completed",
  "workflow_id": "rwa-modular-l1-feed-03",
  "workflow_ref": "<ARTIFACT_ROOT>/fixtures/recording_workflows/rwa_modular/l1-feed-03.json",
  "profile_ref": "<ARTIFACT_ROOT>/fixtures/profiles/rwa_modular_local.json",
  "reset_epoch": {
    "status": "completed",
    "record_id": "rwa:565339bc4d33d728:2026-09-02T02:25:36.552391Z",
    "artifact_ref": "reset/reset.json"
  },
  "actor_bundles": [
    {
      "actor_id": "actor_a",
      "manifest_ref": "actors/actor_a/r20260902-022623-a3ed/session_bundle/manifest.json",
      "run_id": "r20260902-022623-a3ed"
    }
  ],
  "step_correspondence": [
    {
      "status": "step_completed",
      "scenario_step_id": "story.s000",
      "workflow_step_id": "story.s000.open-everyone",
      "global_step_index": 0,
      "actor_id": "actor_a",
      "action_id": "workflow-action-0000",
      "started_at": "2026-09-02T02:26:33.928+00:00",
      "ended_at": "2026-09-02T02:26:35.006+00:00",
      "binding_material_source_step_ids": []
    },
    {
      "status": "step_completed",
      "scenario_step_id": "story.s001",
      "workflow_step_id": "story.s001.paginate-everyone-0",
      "global_step_index": 1,
      "actor_id": "actor_a",
      "action_id": "workflow-action-0001",
      "started_at": "2026-09-02T02:26:35.020+00:00",
      "ended_at": "2026-09-02T02:26:36.054+00:00",
      "binding_material_source_step_ids": []
    },
    {
      "status": "step_completed",
      "scenario_step_id": "story.s002",
      "workflow_step_id": "story.s002.paginate-everyone-1",
      "global_step_index": 2,
      "actor_id": "actor_a",
      "action_id": "workflow-action-0002",
      "started_at": "2026-09-02T02:26:36.079+00:00",
      "ended_at": "2026-09-02T02:26:37.030+00:00",
      "binding_material_source_step_ids": []
    },
    {
      "status": "step_completed",
      "scenario_step_id": "story.s003",
      "workflow_step_id": "story.s003.paginate-everyone-2",
      "global_step_index": 3,
      "actor_id": "actor_a",
      "action_id": "workflow-action-0003",
      "started_at": "2026-09-02T02:26:37.055+00:00",
      "ended_at": "2026-09-02T02:26:37.985+00:00",
      "binding_material_source_step_ids": []
    },
    {
      "status": "step_completed",
      "scenario_step_id": "story.s004",
      "workflow_step_id": "story.s004.open-friends",
      "global_step_index": 4,
      "actor_id": "actor_a",
      "action_id": "workflow-action-0004",
      "started_at": "2026-09-02T02:26:38.014+00:00",
      "ended_at": "2026-09-02T02:26:40.090+00:00",
      "binding_material_source_step_ids": []
    },
    {
      "status": "step_completed",
      "scenario_step_id": "story.s005",
      "workflow_step_id": "story.s005.paginate-friends-0",
      "global_step_index": 5,
      "actor_id": "actor_a",
      "action_id": "workflow-action-0005",
      "started_at": "2026-09-02T02:26:40.142+00:00",
      "ended_at": "2026-09-02T02:26:41.211+00:00",
      "binding_material_source_step_ids": []
    },
    {
      "status": "step_completed",
      "scenario_step_id": "story.s006",
      "workflow_step_id": "story.s006.paginate-friends-1",
      "global_step_index": 6,
      "actor_id": "actor_a",
      "action_id": "workflow-action-0006",
      "started_at": "2026-09-02T02:26:41.238+00:00",
      "ended_at": "2026-09-02T02:26:42.138+00:00",
      "binding_material_source_step_ids": []
    },
    {
      "status": "step_completed",
      "scenario_step_id": "story.s007",
      "workflow_step_id": "story.s007.paginate-friends-2",
      "global_step_index": 7,
      "actor_id": "actor_a",
      "action_id": "workflow-action-0007",
      "started_at": "2026-09-02T02:26:42.163+00:00",
      "ended_at": "2026-09-02T02:26:43.064+00:00",
      "binding_material_source_step_ids": []
    },
    {
      "status": "step_completed",
      "scenario_step_id": "story.s008",
      "workflow_step_id": "story.s008.open-mine",
      "global_step_index": 8,
      "actor_id": "actor_a",
      "action_id": "workflow-action-0008",
      "started_at": "2026-09-02T02:26:43.093+00:00",
      "ended_at": "2026-09-02T02:26:45.105+00:00",
      "binding_material_source_step_ids": []
    },
    {
      "status": "step_completed",
      "scenario_step_id": "story.s009",
      "workflow_step_id": "story.s009.paginate-mine-0",
      "global_step_index": 9,
      "actor_id": "actor_a",
      "action_id": "workflow-action-0009",
      "started_at": "2026-09-02T02:26:45.118+00:00",
      "ended_at": "2026-09-02T02:26:46.098+00:00",
      "binding_material_source_step_ids": []
    },
    {
      "status": "step_completed",
      "scenario_step_id": "story.s010",
      "workflow_step_id": "story.s010.paginate-mine-1",
      "global_step_index": 10,
      "actor_id": "actor_a",
      "action_id": "workflow-action-0010",
      "started_at": "2026-09-02T02:26:46.132+00:00",
      "ended_at": "2026-09-02T02:26:46.945+00:00",
      "binding_material_source_step_ids": []
    },
    {
      "status": "step_completed",
      "scenario_step_id": "story.s011",
      "workflow_step_id": "story.s011.paginate-mine-2",
      "global_step_index": 11,
      "actor_id": "actor_a",
      "action_id": "workflow-action-0011",
      "started_at": "2026-09-02T02:26:46.968+00:00",
      "ended_at": "2026-09-02T02:26:47.871+00:00",
      "binding_material_source_step_ids": []
    }
  ],
  "failure": null
}
