{
  "schema_version": "uisemtest-recording-workflow-result-v1",
  "status": "completed",
  "workflow_id": "l1-permissions-03",
  "workflow_ref": "<ARTIFACT_ROOT>/fixtures/recording_workflows/paperless_modular/l1-permissions-03.json",
  "profile_ref": "<ARTIFACT_ROOT>/fixtures/profiles/paperless_modular_local.json",
  "reset_epoch": {
    "status": "completed",
    "record_id": "paperless-docker-single:1147754992a269cca73ed98d",
    "artifact_ref": "reset/reset.json"
  },
  "actor_bundles": [
    {
      "actor_id": "actor_b",
      "manifest_ref": "actors/actor_b/r20260920-085946-db16/session_bundle/manifest.json",
      "run_id": "r20260920-085946-db16"
    }
  ],
  "step_correspondence": [
    {
      "status": "step_completed",
      "scenario_step_id": "story.s000",
      "workflow_step_id": "story.s000.navigate",
      "global_step_index": 0,
      "actor_id": "actor_b",
      "action_id": "workflow-action-0000",
      "started_at": "2026-09-20T08:59:48.899+00:00",
      "ended_at": "2026-09-20T08:59:49.865+00:00",
      "binding_material_source_step_ids": []
    },
    {
      "status": "step_completed",
      "scenario_step_id": "story.s001",
      "workflow_step_id": "story.s001.navigate",
      "global_step_index": 1,
      "actor_id": "actor_b",
      "action_id": "workflow-action-0001",
      "started_at": "2026-09-20T08:59:51.402+00:00",
      "ended_at": "2026-09-20T08:59:53.019+00:00",
      "binding_material_source_step_ids": []
    }
  ],
  "failure": null
}
