{
  "schema_version": "uisemtest-recording-workflow-result-v1",
  "status": "completed",
  "workflow_id": "rwa-modular-l3-bank-01",
  "workflow_ref": "<ARTIFACT_ROOT>/fixtures/recording_workflows/rwa_modular/l3-bank-01.json",
  "profile_ref": "<ARTIFACT_ROOT>/fixtures/profiles/rwa_modular_local.json",
  "reset_epoch": {
    "status": "completed",
    "record_id": "rwa:565339bc4d33d728:2026-09-06T14:25:01.757483Z",
    "artifact_ref": "reset/reset.json"
  },
  "actor_bundles": [
    {
      "actor_id": "actor_a",
      "manifest_ref": "actors/actor_a/r20260906-142503-90fe/session_bundle/manifest.json",
      "run_id": "r20260906-142503-90fe"
    },
    {
      "actor_id": "actor_b",
      "manifest_ref": "actors/actor_b/r20260906-142503-830f/session_bundle/manifest.json",
      "run_id": "r20260906-142503-830f"
    }
  ],
  "step_correspondence": [
    {
      "status": "step_completed",
      "scenario_step_id": "story.s000",
      "workflow_step_id": "story.s000.open-bank-accounts",
      "global_step_index": 0,
      "actor_id": "actor_a",
      "action_id": "workflow-action-0000",
      "started_at": "2026-09-06T14:25:03.933+00:00",
      "ended_at": "2026-09-06T14:25:03.977+00:00",
      "binding_material_source_step_ids": []
    },
    {
      "status": "step_completed",
      "scenario_step_id": "story.s001",
      "workflow_step_id": "story.s001.create-bank-account",
      "global_step_index": 1,
      "actor_id": "actor_a",
      "action_id": "workflow-action-0001",
      "started_at": "2026-09-06T14:25:03.988+00:00",
      "ended_at": "2026-09-06T14:25:04.016+00:00",
      "binding_material_source_step_ids": []
    },
    {
      "status": "step_completed",
      "scenario_step_id": "story.s002",
      "workflow_step_id": "story.s002.fill-bank-name",
      "global_step_index": 2,
      "actor_id": "actor_a",
      "action_id": "workflow-action-0002",
      "started_at": "2026-09-06T14:25:04.033+00:00",
      "ended_at": "2026-09-06T14:25:04.041+00:00",
      "binding_material_source_step_ids": []
    },
    {
      "status": "step_completed",
      "scenario_step_id": "story.s003",
      "workflow_step_id": "story.s003.fill-routing-number",
      "global_step_index": 3,
      "actor_id": "actor_a",
      "action_id": "workflow-action-0003",
      "started_at": "2026-09-06T14:25:04.057+00:00",
      "ended_at": "2026-09-06T14:25:04.065+00:00",
      "binding_material_source_step_ids": []
    },
    {
      "status": "step_completed",
      "scenario_step_id": "story.s004",
      "workflow_step_id": "story.s004.fill-account-number",
      "global_step_index": 4,
      "actor_id": "actor_a",
      "action_id": "workflow-action-0004",
      "started_at": "2026-09-06T14:25:04.082+00:00",
      "ended_at": "2026-09-06T14:25:04.089+00:00",
      "binding_material_source_step_ids": []
    },
    {
      "status": "step_completed",
      "scenario_step_id": "story.s005",
      "workflow_step_id": "story.s005.save-bank-account",
      "global_step_index": 5,
      "actor_id": "actor_a",
      "action_id": "workflow-action-0005",
      "started_at": "2026-09-06T14:25:04.106+00:00",
      "ended_at": "2026-09-06T14:25:04.160+00:00",
      "binding_material_source_step_ids": [
        "story.s002.fill-bank-name",
        "story.s003.fill-routing-number",
        "story.s004.fill-account-number"
      ]
    },
    {
      "status": "step_completed",
      "scenario_step_id": "story.s006",
      "workflow_step_id": "story.s006.b-open-bankaccounts",
      "global_step_index": 6,
      "actor_id": "actor_b",
      "action_id": "workflow-action-0006",
      "started_at": "2026-09-06T14:25:04.172+00:00",
      "ended_at": "2026-09-06T14:25:04.282+00:00",
      "binding_material_source_step_ids": []
    },
    {
      "status": "step_completed",
      "scenario_step_id": "story.s007",
      "workflow_step_id": "story.s007.delete-bank-account",
      "global_step_index": 7,
      "actor_id": "actor_a",
      "action_id": "workflow-action-0007",
      "started_at": "2026-09-06T14:25:04.294+00:00",
      "ended_at": "2026-09-06T14:25:04.347+00:00",
      "binding_material_source_step_ids": []
    },
    {
      "status": "step_completed",
      "scenario_step_id": "story.s008",
      "workflow_step_id": "story.s008.b-reload-bankaccounts",
      "global_step_index": 8,
      "actor_id": "actor_b",
      "action_id": "workflow-action-0008",
      "started_at": "2026-09-06T14:25:04.358+00:00",
      "ended_at": "2026-09-06T14:25:04.441+00:00",
      "binding_material_source_step_ids": []
    }
  ],
  "failure": null
}
