{
  "schema_version": "uisemtest-recording-workflow-result-v1",
  "status": "completed",
  "workflow_id": "rwa-modular-l1-feed-02",
  "workflow_ref": "<ARTIFACT_ROOT>/fixtures/recording_workflows/rwa_modular/l1-feed-02.json",
  "profile_ref": "<ARTIFACT_ROOT>/fixtures/profiles/rwa_modular_local.json",
  "reset_epoch": {
    "status": "completed",
    "record_id": "rwa:565339bc4d33d728:2026-09-02T02:24:35.689221Z",
    "artifact_ref": "reset/reset.json"
  },
  "actor_bundles": [
    {
      "actor_id": "actor_a",
      "manifest_ref": "actors/actor_a/r20260902-022519-fabf/session_bundle/manifest.json",
      "run_id": "r20260902-022519-fabf"
    }
  ],
  "step_correspondence": [
    {
      "status": "step_completed",
      "scenario_step_id": "story.s000",
      "workflow_step_id": "story.s000.open-everyone",
      "global_step_index": 0,
      "actor_id": "actor_a",
      "action_id": "workflow-action-0000",
      "started_at": "2026-09-02T02:25:31.246+00:00",
      "ended_at": "2026-09-02T02:25:35.895+00:00",
      "binding_material_source_step_ids": []
    }
  ],
  "failure": null
}
