{
  "schema_version": "uisemtest-recording-workflow-result-v1",
  "status": "completed",
  "workflow_id": "ghost-modular-l1-setting-02",
  "workflow_ref": "<ARTIFACT_ROOT>/fixtures/recording_workflows/ghost_modular/l1-setting-02.json",
  "profile_ref": "<ARTIFACT_ROOT>/fixtures/profiles/ghost_modular_local.json",
  "reset_epoch": {
    "status": "completed",
    "record_id": "ghost-docker-single:f15c8ef4db2910159ae1decc",
    "artifact_ref": "reset/reset.json"
  },
  "actor_bundles": [
    {
      "actor_id": "actor_a",
      "manifest_ref": "actors/actor_a/r20260920-170815-cf1e/session_bundle/manifest.json",
      "run_id": "r20260920-170815-cf1e"
    }
  ],
  "step_correspondence": [
    {
      "status": "step_completed",
      "scenario_step_id": "story.s000",
      "workflow_step_id": "story.s000.click-testid-metadata-edit",
      "global_step_index": 0,
      "actor_id": "actor_a",
      "action_id": "workflow-action-0000",
      "started_at": "2026-09-20T17:08:17.054+00:00",
      "ended_at": "2026-09-20T17:08:17.179+00:00",
      "binding_material_source_step_ids": []
    },
    {
      "status": "step_completed",
      "scenario_step_id": "story.s001",
      "workflow_step_id": "story.s001.fill-meta-title",
      "global_step_index": 1,
      "actor_id": "actor_a",
      "action_id": "workflow-action-0001",
      "started_at": "2026-09-20T17:08:17.254+00:00",
      "ended_at": "2026-09-20T17:08:17.520+00:00",
      "binding_material_source_step_ids": []
    },
    {
      "status": "step_completed",
      "scenario_step_id": "story.s002",
      "workflow_step_id": "story.s002.fill-meta-description",
      "global_step_index": 2,
      "actor_id": "actor_a",
      "action_id": "workflow-action-0002",
      "started_at": "2026-09-20T17:08:17.595+00:00",
      "ended_at": "2026-09-20T17:08:17.855+00:00",
      "binding_material_source_step_ids": []
    },
    {
      "status": "step_completed",
      "scenario_step_id": "story.s003",
      "workflow_step_id": "story.s003.click-testid-metadata-save",
      "global_step_index": 3,
      "actor_id": "actor_a",
      "action_id": "workflow-action-0003",
      "started_at": "2026-09-20T17:08:17.927+00:00",
      "ended_at": "2026-09-20T17:08:20.672+00:00",
      "binding_material_source_step_ids": []
    }
  ],
  "failure": null
}
