{
  "schema_version": "uisemtest-recording-workflow-result-v1",
  "status": "completed",
  "workflow_id": "conduit-modular-l1-auth-06",
  "workflow_ref": "<ARTIFACT_ROOT>/fixtures/recording_workflows/conduit_modular/l1-auth-06.json",
  "profile_ref": "<ARTIFACT_ROOT>/fixtures/profiles/conduit_guest_current_local.json",
  "reset_epoch": {
    "status": "completed",
    "record_id": "conduit-current:b98a92c83c9f902950b61ce6",
    "artifact_ref": "reset/reset.json"
  },
  "actor_bundles": [
    {
      "actor_id": "guest",
      "manifest_ref": "actors/guest/r20260901-185856-ed8a/session_bundle/manifest.json",
      "run_id": "r20260901-185856-ed8a"
    }
  ],
  "step_correspondence": [
    {
      "status": "step_completed",
      "scenario_step_id": "story.s000",
      "workflow_step_id": "story.s000.open-protected-settings",
      "global_step_index": 0,
      "actor_id": "guest",
      "action_id": "workflow-action-0000",
      "started_at": "2026-09-01T18:58:58.530+00:00",
      "ended_at": "2026-09-01T18:58:59.043+00:00",
      "binding_material_source_step_ids": []
    },
    {
      "status": "step_completed",
      "scenario_step_id": "story.s001",
      "workflow_step_id": "story.s001.open-protected-editor",
      "global_step_index": 1,
      "actor_id": "guest",
      "action_id": "workflow-action-0001",
      "started_at": "2026-09-01T18:58:59.047+00:00",
      "ended_at": "2026-09-01T18:58:59.384+00:00",
      "binding_material_source_step_ids": []
    },
    {
      "status": "step_completed",
      "scenario_step_id": "story.s002",
      "workflow_step_id": "story.s002.open-protected-edit",
      "global_step_index": 2,
      "actor_id": "guest",
      "action_id": "workflow-action-0002",
      "started_at": "2026-09-01T18:58:59.389+00:00",
      "ended_at": "2026-09-01T18:58:59.613+00:00",
      "binding_material_source_step_ids": []
    }
  ],
  "failure": null
}
