{
  "schema_version": "uisemtest-recording-workflow-result-v1",
  "status": "completed",
  "workflow_id": "conduit-modular-l1-auth-05",
  "workflow_ref": "<ARTIFACT_ROOT>/fixtures/recording_workflows/conduit_modular/l1-auth-05.json",
  "profile_ref": "<ARTIFACT_ROOT>/fixtures/profiles/conduit_current_local.json",
  "reset_epoch": {
    "status": "completed",
    "record_id": "conduit-current:985bc80e88c867db8584ad74",
    "artifact_ref": "reset/reset.json"
  },
  "actor_bundles": [
    {
      "actor_id": "actor_a",
      "manifest_ref": "actors/actor_a/r20260901-185839-bbbd/session_bundle/manifest.json",
      "run_id": "r20260901-185839-bbbd"
    }
  ],
  "step_correspondence": [
    {
      "status": "step_completed",
      "scenario_step_id": "story.s000",
      "workflow_step_id": "story.s000.open-user-menu",
      "global_step_index": 0,
      "actor_id": "actor_a",
      "action_id": "workflow-action-0000",
      "started_at": "2026-09-01T18:58:40.678+00:00",
      "ended_at": "2026-09-01T18:58:41.001+00:00",
      "binding_material_source_step_ids": []
    },
    {
      "status": "step_completed",
      "scenario_step_id": "story.s001",
      "workflow_step_id": "story.s001.logout",
      "global_step_index": 1,
      "actor_id": "actor_a",
      "action_id": "workflow-action-0001",
      "started_at": "2026-09-01T18:58:41.005+00:00",
      "ended_at": "2026-09-01T18:58:41.703+00:00",
      "binding_material_source_step_ids": []
    }
  ],
  "failure": null
}
