{
  "schema_version": "uisemtest-recording-workflow-result-v1",
  "status": "completed",
  "workflow_id": "rwa-modular-l1-detail-01",
  "workflow_ref": "<ARTIFACT_ROOT>/fixtures/recording_workflows/rwa_modular/l1-detail-01.json",
  "profile_ref": "<ARTIFACT_ROOT>/fixtures/profiles/rwa_modular_local.json",
  "reset_epoch": {
    "status": "completed",
    "record_id": "rwa:565339bc4d33d728:2026-09-02T02:29:33.927392Z",
    "artifact_ref": "reset/reset.json"
  },
  "actor_bundles": [
    {
      "actor_id": "actor_a",
      "manifest_ref": "actors/actor_a/r20260902-023019-5662/session_bundle/manifest.json",
      "run_id": "r20260902-023019-5662"
    }
  ],
  "step_correspondence": [
    {
      "status": "step_completed",
      "scenario_step_id": "story.s000",
      "workflow_step_id": "story.s000.open-new-transaction",
      "global_step_index": 0,
      "actor_id": "actor_a",
      "action_id": "workflow-action-0000",
      "started_at": "2026-09-02T02:30:28.797+00:00",
      "ended_at": "2026-09-02T02:30:31.226+00:00",
      "binding_material_source_step_ids": []
    },
    {
      "status": "step_completed",
      "scenario_step_id": "story.s001",
      "workflow_step_id": "story.s001.search-receiver",
      "global_step_index": 1,
      "actor_id": "actor_a",
      "action_id": "workflow-action-0001",
      "started_at": "2026-09-02T02:30:31.263+00:00",
      "ended_at": "2026-09-02T02:30:32.548+00:00",
      "binding_material_source_step_ids": []
    },
    {
      "status": "step_completed",
      "scenario_step_id": "story.s002",
      "workflow_step_id": "story.s002.select-receiver",
      "global_step_index": 2,
      "actor_id": "actor_a",
      "action_id": "workflow-action-0002",
      "started_at": "2026-09-02T02:30:32.569+00:00",
      "ended_at": "2026-09-02T02:30:33.810+00:00",
      "binding_material_source_step_ids": []
    },
    {
      "status": "step_completed",
      "scenario_step_id": "story.s003",
      "workflow_step_id": "story.s003.fill-amount",
      "global_step_index": 3,
      "actor_id": "actor_a",
      "action_id": "workflow-action-0003",
      "started_at": "2026-09-02T02:30:33.834+00:00",
      "ended_at": "2026-09-02T02:30:34.119+00:00",
      "binding_material_source_step_ids": []
    },
    {
      "status": "step_completed",
      "scenario_step_id": "story.s004",
      "workflow_step_id": "story.s004.fill-description",
      "global_step_index": 4,
      "actor_id": "actor_a",
      "action_id": "workflow-action-0004",
      "started_at": "2026-09-02T02:30:34.180+00:00",
      "ended_at": "2026-09-02T02:30:34.661+00:00",
      "binding_material_source_step_ids": []
    },
    {
      "status": "step_completed",
      "scenario_step_id": "story.s005",
      "workflow_step_id": "story.s005.submit-payment",
      "global_step_index": 5,
      "actor_id": "actor_a",
      "action_id": "workflow-action-0005",
      "started_at": "2026-09-02T02:30:34.777+00:00",
      "ended_at": "2026-09-02T02:30:37.292+00:00",
      "binding_material_source_step_ids": [
        "story.s001.search-receiver",
        "story.s003.fill-amount",
        "story.s004.fill-description"
      ]
    },
    {
      "status": "step_completed",
      "scenario_step_id": "story.s006",
      "workflow_step_id": "story.s006.return-to-transactions",
      "global_step_index": 6,
      "actor_id": "actor_a",
      "action_id": "workflow-action-0006",
      "started_at": "2026-09-02T02:30:37.414+00:00",
      "ended_at": "2026-09-02T02:30:40.924+00:00",
      "binding_material_source_step_ids": []
    },
    {
      "status": "step_completed",
      "scenario_step_id": "story.s007",
      "workflow_step_id": "story.s007.open-mine-feed",
      "global_step_index": 7,
      "actor_id": "actor_a",
      "action_id": "workflow-action-0007",
      "started_at": "2026-09-02T02:30:40.948+00:00",
      "ended_at": "2026-09-02T02:30:42.990+00:00",
      "binding_material_source_step_ids": []
    },
    {
      "status": "step_completed",
      "scenario_step_id": "story.s008",
      "workflow_step_id": "story.s008.open-transaction-detail",
      "global_step_index": 8,
      "actor_id": "actor_a",
      "action_id": "workflow-action-0008",
      "started_at": "2026-09-02T02:30:43.003+00:00",
      "ended_at": "2026-09-02T02:30:44.055+00:00",
      "binding_material_source_step_ids": []
    }
  ],
  "failure": null
}
