{
  "schema_version": "uisemtest-recording-workflow-result-v1",
  "status": "completed",
  "workflow_id": "ghost-modular-l1-setting-03",
  "workflow_ref": "<ARTIFACT_ROOT>/fixtures/recording_workflows/ghost_modular/l1-setting-03.json",
  "profile_ref": "<ARTIFACT_ROOT>/fixtures/profiles/ghost_modular_local.json",
  "reset_epoch": {
    "status": "completed",
    "record_id": "ghost-docker-single:bff257ad245cbd95f83607fc",
    "artifact_ref": "reset/reset.json"
  },
  "actor_bundles": [
    {
      "actor_id": "actor_a",
      "manifest_ref": "actors/actor_a/r20260920-170828-fa5f/session_bundle/manifest.json",
      "run_id": "r20260920-170828-fa5f"
    }
  ],
  "step_correspondence": [
    {
      "status": "step_completed",
      "scenario_step_id": "story.s000",
      "workflow_step_id": "story.s000.click-settings",
      "global_step_index": 0,
      "actor_id": "actor_a",
      "action_id": "workflow-action-0000",
      "started_at": "2026-09-20T17:08:31.235+00:00",
      "ended_at": "2026-09-20T17:08:35.315+00:00",
      "binding_material_source_step_ids": []
    }
  ],
  "failure": null
}
