{
  "schema_version": "uisemtest-recording-workflow-result-v1",
  "status": "completed",
  "workflow_id": "conduit-modular-l4-follow-01",
  "workflow_ref": "<ARTIFACT_ROOT>/fixtures/recording_workflows/conduit_modular/l4-follow-01.json",
  "profile_ref": "<ARTIFACT_ROOT>/fixtures/profiles/conduit_current_local.json",
  "reset_epoch": {
    "status": "completed",
    "record_id": "conduit-current:cc1f35cc18ac9d37c8112262",
    "artifact_ref": "reset/reset.json"
  },
  "actor_bundles": [
    {
      "actor_id": "actor_a",
      "manifest_ref": "actors/actor_a/r20260906-142026-59dd/session_bundle/manifest.json",
      "run_id": "r20260906-142026-59dd"
    },
    {
      "actor_id": "actor_b",
      "manifest_ref": "actors/actor_b/r20260906-142026-5402/session_bundle/manifest.json",
      "run_id": "r20260906-142026-5402"
    }
  ],
  "step_correspondence": [
    {
      "status": "step_completed",
      "scenario_step_id": "story.s000",
      "workflow_step_id": "story.s000.open-editor",
      "global_step_index": 0,
      "actor_id": "actor_a",
      "action_id": "workflow-action-0000",
      "started_at": "2026-09-06T14:20:26.535+00:00",
      "ended_at": "2026-09-06T14:20:26.560+00:00",
      "binding_material_source_step_ids": []
    },
    {
      "status": "step_completed",
      "scenario_step_id": "story.s001",
      "workflow_step_id": "story.s001.fill-title",
      "global_step_index": 1,
      "actor_id": "actor_a",
      "action_id": "workflow-action-0001",
      "started_at": "2026-09-06T14:20:26.565+00:00",
      "ended_at": "2026-09-06T14:20:26.571+00:00",
      "binding_material_source_step_ids": []
    },
    {
      "status": "step_completed",
      "scenario_step_id": "story.s002",
      "workflow_step_id": "story.s002.fill-description",
      "global_step_index": 2,
      "actor_id": "actor_a",
      "action_id": "workflow-action-0002",
      "started_at": "2026-09-06T14:20:26.577+00:00",
      "ended_at": "2026-09-06T14:20:26.582+00:00",
      "binding_material_source_step_ids": []
    },
    {
      "status": "step_completed",
      "scenario_step_id": "story.s003",
      "workflow_step_id": "story.s003.fill-body",
      "global_step_index": 3,
      "actor_id": "actor_a",
      "action_id": "workflow-action-0003",
      "started_at": "2026-09-06T14:20:26.588+00:00",
      "ended_at": "2026-09-06T14:20:26.593+00:00",
      "binding_material_source_step_ids": []
    },
    {
      "status": "step_completed",
      "scenario_step_id": "story.s004",
      "workflow_step_id": "story.s004.fill-tags",
      "global_step_index": 4,
      "actor_id": "actor_a",
      "action_id": "workflow-action-0004",
      "started_at": "2026-09-06T14:20:26.597+00:00",
      "ended_at": "2026-09-06T14:20:26.601+00:00",
      "binding_material_source_step_ids": []
    },
    {
      "status": "step_completed",
      "scenario_step_id": "story.s005",
      "workflow_step_id": "story.s005.publish-article",
      "global_step_index": 5,
      "actor_id": "actor_a",
      "action_id": "workflow-action-0005",
      "started_at": "2026-09-06T14:20:26.607+00:00",
      "ended_at": "2026-09-06T14:20:26.951+00:00",
      "binding_material_source_step_ids": [
        "story.s001.fill-title",
        "story.s002.fill-description",
        "story.s003.fill-body",
        "story.s004.fill-tags"
      ]
    },
    {
      "status": "step_completed",
      "scenario_step_id": "story.s006",
      "workflow_step_id": "story.s006.open-profile-route",
      "global_step_index": 6,
      "actor_id": "actor_b",
      "action_id": "workflow-action-0006",
      "started_at": "2026-09-06T14:20:26.965+00:00",
      "ended_at": "2026-09-06T14:20:26.982+00:00",
      "binding_material_source_step_ids": []
    },
    {
      "status": "step_completed",
      "scenario_step_id": "story.s007",
      "workflow_step_id": "story.s007.follow-author-profile",
      "global_step_index": 7,
      "actor_id": "actor_b",
      "action_id": "workflow-action-0007",
      "started_at": "2026-09-06T14:20:26.998+00:00",
      "ended_at": "2026-09-06T14:20:27.242+00:00",
      "binding_material_source_step_ids": []
    },
    {
      "status": "step_completed",
      "scenario_step_id": "story.s008",
      "workflow_step_id": "story.s008.navigate-home",
      "global_step_index": 8,
      "actor_id": "actor_b",
      "action_id": "workflow-action-0008",
      "started_at": "2026-09-06T14:20:27.248+00:00",
      "ended_at": "2026-09-06T14:20:27.296+00:00",
      "binding_material_source_step_ids": []
    },
    {
      "status": "step_completed",
      "scenario_step_id": "story.s009",
      "workflow_step_id": "story.s009.select-your-feed",
      "global_step_index": 9,
      "actor_id": "actor_b",
      "action_id": "workflow-action-0009",
      "started_at": "2026-09-06T14:20:27.300+00:00",
      "ended_at": "2026-09-06T14:20:27.535+00:00",
      "binding_material_source_step_ids": []
    },
    {
      "status": "step_completed",
      "scenario_step_id": "story.s010",
      "workflow_step_id": "story.s010.open-author-from-preview",
      "global_step_index": 10,
      "actor_id": "actor_b",
      "action_id": "workflow-action-0010",
      "started_at": "2026-09-06T14:20:27.542+00:00",
      "ended_at": "2026-09-06T14:20:27.564+00:00",
      "binding_material_source_step_ids": []
    },
    {
      "status": "step_completed",
      "scenario_step_id": "story.s011",
      "workflow_step_id": "story.s011.unfollow-author-profile",
      "global_step_index": 11,
      "actor_id": "actor_b",
      "action_id": "workflow-action-0011",
      "started_at": "2026-09-06T14:20:27.573+00:00",
      "ended_at": "2026-09-06T14:20:27.809+00:00",
      "binding_material_source_step_ids": []
    },
    {
      "status": "step_completed",
      "scenario_step_id": "story.s012",
      "workflow_step_id": "story.s012.return-home",
      "global_step_index": 12,
      "actor_id": "actor_b",
      "action_id": "workflow-action-0012",
      "started_at": "2026-09-06T14:20:27.817+00:00",
      "ended_at": "2026-09-06T14:20:27.852+00:00",
      "binding_material_source_step_ids": []
    },
    {
      "status": "step_completed",
      "scenario_step_id": "story.s013",
      "workflow_step_id": "story.s013.select-your-feed-after-unfollow",
      "global_step_index": 13,
      "actor_id": "actor_b",
      "action_id": "workflow-action-0013",
      "started_at": "2026-09-06T14:20:27.857+00:00",
      "ended_at": "2026-09-06T14:20:28.096+00:00",
      "binding_material_source_step_ids": []
    }
  ],
  "failure": null
}
