{
  "schema_version": "uisemtest-recording-workflow-result-v1",
  "status": "completed",
  "workflow_id": "ghost-modular-l2-post-10",
  "workflow_ref": "<ARTIFACT_ROOT>/fixtures/recording_workflows/ghost_modular/l2-post-10.json",
  "profile_ref": "<ARTIFACT_ROOT>/fixtures/profiles/ghost_modular_local.json",
  "reset_epoch": {
    "status": "completed",
    "record_id": "ghost-docker-single:d9629f20810baf74d1616783",
    "artifact_ref": "reset/reset.json"
  },
  "actor_bundles": [
    {
      "actor_id": "actor_a",
      "manifest_ref": "actors/actor_a/r20260920-170223-60c0/session_bundle/manifest.json",
      "run_id": "r20260920-170223-60c0"
    }
  ],
  "step_correspondence": [
    {
      "status": "step_completed",
      "scenario_step_id": "story.s000",
      "workflow_step_id": "story.s000.click-new-post",
      "global_step_index": 0,
      "actor_id": "actor_a",
      "action_id": "workflow-action-0000",
      "started_at": "2026-09-20T17:02:25.571+00:00",
      "ended_at": "2026-09-20T17:02:25.748+00:00",
      "binding_material_source_step_ids": []
    },
    {
      "status": "step_completed",
      "scenario_step_id": "story.s001",
      "workflow_step_id": "story.s001.fill-editor-title",
      "global_step_index": 1,
      "actor_id": "actor_a",
      "action_id": "workflow-action-0001",
      "started_at": "2026-09-20T17:02:25.777+00:00",
      "ended_at": "2026-09-20T17:02:26.038+00:00",
      "binding_material_source_step_ids": []
    },
    {
      "status": "step_completed",
      "scenario_step_id": "story.s002",
      "workflow_step_id": "story.s002.press-enter",
      "global_step_index": 2,
      "actor_id": "actor_a",
      "action_id": "workflow-action-0002",
      "started_at": "2026-09-20T17:02:26.066+00:00",
      "ended_at": "2026-09-20T17:02:29.786+00:00",
      "binding_material_source_step_ids": []
    },
    {
      "status": "step_completed",
      "scenario_step_id": "story.s003",
      "workflow_step_id": "story.s003.click-editor-header-publish",
      "global_step_index": 3,
      "actor_id": "actor_a",
      "action_id": "workflow-action-0003",
      "started_at": "2026-09-20T17:02:29.814+00:00",
      "ended_at": "2026-09-20T17:02:29.846+00:00",
      "binding_material_source_step_ids": []
    },
    {
      "status": "step_completed",
      "scenario_step_id": "story.s004",
      "workflow_step_id": "story.s004.click-continue",
      "global_step_index": 4,
      "actor_id": "actor_a",
      "action_id": "workflow-action-0004",
      "started_at": "2026-09-20T17:02:29.876+00:00",
      "ended_at": "2026-09-20T17:02:30.167+00:00",
      "binding_material_source_step_ids": []
    },
    {
      "status": "step_completed",
      "scenario_step_id": "story.s005",
      "workflow_step_id": "story.s005.press-enter",
      "global_step_index": 5,
      "actor_id": "actor_a",
      "action_id": "workflow-action-0005",
      "started_at": "2026-09-20T17:02:30.195+00:00",
      "ended_at": "2026-09-20T17:02:30.794+00:00",
      "binding_material_source_step_ids": []
    },
    {
      "status": "step_completed",
      "scenario_step_id": "story.s006",
      "workflow_step_id": "story.s006.click-close-publish-flow",
      "global_step_index": 6,
      "actor_id": "actor_a",
      "action_id": "workflow-action-0006",
      "started_at": "2026-09-20T17:02:30.826+00:00",
      "ended_at": "2026-09-20T17:02:31.247+00:00",
      "binding_material_source_step_ids": []
    },
    {
      "status": "step_completed",
      "scenario_step_id": "story.s007",
      "workflow_step_id": "story.s007.click-post-list-title",
      "global_step_index": 7,
      "actor_id": "actor_a",
      "action_id": "workflow-action-0007",
      "started_at": "2026-09-20T17:02:31.278+00:00",
      "ended_at": "2026-09-20T17:02:31.739+00:00",
      "binding_material_source_step_ids": []
    },
    {
      "status": "step_completed",
      "scenario_step_id": "story.s008",
      "workflow_step_id": "story.s008.click-psm-trigger",
      "global_step_index": 8,
      "actor_id": "actor_a",
      "action_id": "workflow-action-0008",
      "started_at": "2026-09-20T17:02:31.781+00:00",
      "ended_at": "2026-09-20T17:02:32.071+00:00",
      "binding_material_source_step_ids": []
    },
    {
      "status": "step_completed",
      "scenario_step_id": "story.s009",
      "workflow_step_id": "story.s009.fill-custom-excerpt",
      "global_step_index": 9,
      "actor_id": "actor_a",
      "action_id": "workflow-action-0009",
      "started_at": "2026-09-20T17:02:32.102+00:00",
      "ended_at": "2026-09-20T17:02:32.360+00:00",
      "binding_material_source_step_ids": []
    },
    {
      "status": "step_completed",
      "scenario_step_id": "story.s010",
      "workflow_step_id": "story.s010.click-psm-trigger",
      "global_step_index": 10,
      "actor_id": "actor_a",
      "action_id": "workflow-action-0010",
      "started_at": "2026-09-20T17:02:32.394+00:00",
      "ended_at": "2026-09-20T17:02:32.517+00:00",
      "binding_material_source_step_ids": []
    },
    {
      "status": "step_completed",
      "scenario_step_id": "story.s011",
      "workflow_step_id": "story.s011.fill-editor-title",
      "global_step_index": 11,
      "actor_id": "actor_a",
      "action_id": "workflow-action-0011",
      "started_at": "2026-09-20T17:02:32.550+00:00",
      "ended_at": "2026-09-20T17:02:32.811+00:00",
      "binding_material_source_step_ids": []
    },
    {
      "status": "step_completed",
      "scenario_step_id": "story.s012",
      "workflow_step_id": "story.s012.press-enter",
      "global_step_index": 12,
      "actor_id": "actor_a",
      "action_id": "workflow-action-0012",
      "started_at": "2026-09-20T17:02:32.838+00:00",
      "ended_at": "2026-09-20T17:02:33.095+00:00",
      "binding_material_source_step_ids": []
    },
    {
      "status": "step_completed",
      "scenario_step_id": "story.s013",
      "workflow_step_id": "story.s013.click-editor-header-publish",
      "global_step_index": 13,
      "actor_id": "actor_a",
      "action_id": "workflow-action-0013",
      "started_at": "2026-09-20T17:02:33.123+00:00",
      "ended_at": "2026-09-20T17:02:33.550+00:00",
      "binding_material_source_step_ids": []
    }
  ],
  "failure": null
}
