{
  "schema_version": "uisemtest-recording-workflow-result-v1",
  "status": "completed",
  "workflow_id": "rwa-modular-l1-txn-02",
  "workflow_ref": "<ARTIFACT_ROOT>/fixtures/recording_workflows/rwa_modular/l1-txn-02.json",
  "profile_ref": "<ARTIFACT_ROOT>/fixtures/profiles/rwa_modular_local.json",
  "reset_epoch": {
    "status": "completed",
    "record_id": "rwa:565339bc4d33d728:2026-09-02T02:22:26.566257Z",
    "artifact_ref": "reset/reset.json"
  },
  "actor_bundles": [
    {
      "actor_id": "actor_a",
      "manifest_ref": "actors/actor_a/r20260902-022310-f8a2/session_bundle/manifest.json",
      "run_id": "r20260902-022310-f8a2"
    }
  ],
  "step_correspondence": [
    {
      "status": "step_completed",
      "scenario_step_id": "story.s000",
      "workflow_step_id": "story.s000.observe-start-balance",
      "global_step_index": 0,
      "actor_id": "actor_a",
      "action_id": "workflow-action-0000",
      "started_at": "2026-09-02T02:23:20.974+00:00",
      "ended_at": "2026-09-02T02:23:21.113+00:00",
      "binding_material_source_step_ids": []
    },
    {
      "status": "step_completed",
      "scenario_step_id": "story.s001",
      "workflow_step_id": "story.s001.open-new-transaction",
      "global_step_index": 1,
      "actor_id": "actor_a",
      "action_id": "workflow-action-0001",
      "started_at": "2026-09-02T02:23:21.124+00:00",
      "ended_at": "2026-09-02T02:23:23.240+00:00",
      "binding_material_source_step_ids": []
    },
    {
      "status": "step_completed",
      "scenario_step_id": "story.s002",
      "workflow_step_id": "story.s002.search-receiver",
      "global_step_index": 2,
      "actor_id": "actor_a",
      "action_id": "workflow-action-0002",
      "started_at": "2026-09-02T02:23:23.277+00:00",
      "ended_at": "2026-09-02T02:23:24.618+00:00",
      "binding_material_source_step_ids": []
    },
    {
      "status": "step_completed",
      "scenario_step_id": "story.s003",
      "workflow_step_id": "story.s003.select-receiver",
      "global_step_index": 3,
      "actor_id": "actor_a",
      "action_id": "workflow-action-0003",
      "started_at": "2026-09-02T02:23:24.640+00:00",
      "ended_at": "2026-09-02T02:23:25.839+00:00",
      "binding_material_source_step_ids": []
    },
    {
      "status": "step_completed",
      "scenario_step_id": "story.s004",
      "workflow_step_id": "story.s004.fill-amount",
      "global_step_index": 4,
      "actor_id": "actor_a",
      "action_id": "workflow-action-0004",
      "started_at": "2026-09-02T02:23:25.935+00:00",
      "ended_at": "2026-09-02T02:23:26.225+00:00",
      "binding_material_source_step_ids": []
    },
    {
      "status": "step_completed",
      "scenario_step_id": "story.s005",
      "workflow_step_id": "story.s005.fill-description",
      "global_step_index": 5,
      "actor_id": "actor_a",
      "action_id": "workflow-action-0005",
      "started_at": "2026-09-02T02:23:26.279+00:00",
      "ended_at": "2026-09-02T02:23:26.817+00:00",
      "binding_material_source_step_ids": []
    },
    {
      "status": "step_completed",
      "scenario_step_id": "story.s006",
      "workflow_step_id": "story.s006.submit-payment",
      "global_step_index": 6,
      "actor_id": "actor_a",
      "action_id": "workflow-action-0006",
      "started_at": "2026-09-02T02:23:26.953+00:00",
      "ended_at": "2026-09-02T02:23:29.510+00:00",
      "binding_material_source_step_ids": [
        "story.s002.search-receiver",
        "story.s004.fill-amount",
        "story.s005.fill-description"
      ]
    },
    {
      "status": "step_completed",
      "scenario_step_id": "story.s007",
      "workflow_step_id": "story.s007.observe-updated-balance",
      "global_step_index": 7,
      "actor_id": "actor_a",
      "action_id": "workflow-action-0007",
      "started_at": "2026-09-02T02:23:29.590+00:00",
      "ended_at": "2026-09-02T02:23:29.680+00:00",
      "binding_material_source_step_ids": []
    }
  ],
  "failure": null
}
